{
  "apiVersion": "sloom.dev/v1alpha1",
  "kind": "Skill",
  "metadata": {
    "id": "implementation.targeted-fix",
    "version": "1.0.0",
    "title": "Targeted Fix Implementation",
    "skillPath": "examples/skills/targeted-fix",
    "owners": ["engineering"]
  },
  "spec": {
    "intents": ["bugfix", "feature"],
    "capabilities": ["implementation", "typescript", "small-change", "bugfix"],
    "inputs": { "required": ["repo.context"], "optional": ["requirement.spec", "architecture.decision"] },
    "outputs": ["source.diff", "implementation.summary"],
    "execution": { "preferredExecutor": "claude-code", "fallbackExecutors": ["codex"], "workspace": "isolated-worktree", "timeoutMinutes": 40, "parallelSafe": false },
    "policy": { "risk": "medium", "permissions": ["filesystem.write", "git.diff", "shell.test"], "denyCommands": ["rm -rf", "git push", "kubectl apply"] },
    "routing": { "includeKeywords": ["修复", "bug", "fix", "实现", "开发", "改动"], "excludeKeywords": ["仅文档", "发布"], "cost": "medium", "tags": ["implementation", "bugfix"] },
    "gates": { "before": [{ "artifact": "repo.context" }], "after": [{ "artifact": "source.diff" }, { "artifact": "implementation.summary" }] }
  }
}
